{
  "$schema": "https://json-schema.org/draft/2020-12/schema",
  "$id": "https://live-comc-app/schemas/output.schema.json",
  "title": "output",
  "description": "파이프라인 ⑧ 화면 오버레이 + ⑨ TTS 재생의 동시 출력 봉투. 둘 다 verdict.final_text에서 나오므로 한 계약(overlay+spoken)으로 묶어 7종을 유지한다. (설계 결정: 파이프라인 다이어그램의 '동시 출력' 반영)",
  "type": "object",
  "properties": {
    "overlay": {
      "type": "object",
      "description": "⑧ OBS Browser Source가 폴링하는 화면 텍스트",
      "properties": {
        "text": {
          "type": "string",
          "description": "화면에 표시할 최종 텍스트 (= verdict.final_text)"
        },
        "part_id": {
          "type": "string",
          "description": "현재 파트 id"
        },
        "updated_at": {
          "type": "string",
          "format": "date-time"
        },
        "persona": {"type": "string"},
        "captioned": {"type": "boolean"}
      },
      "required": [
        "text",
        "updated_at"
      ],
      "additionalProperties": false
    },
    "spoken": {
      "type": "object",
      "description": "⑨ TTS 재생 결과",
      "properties": {
        "text": {
          "type": "string",
          "description": "TTS로 발화할 텍스트 (= verdict.final_text)"
        },
        "provider": {
          "type": "string",
          "description": "이 발화를 합성한 TTS 프로바이더 (edge/openai/qwen/elevenlabs). voice id 로 역추정하지 않고 명시한다 — 서킷 브레이커가 런타임에 프로바이더를 교체하므로, 사후 분석 때 '어느 발화가 강등/승격 이후였는지'를 가르는 유일한 근거다. 2026-08-23 M7 착수 시 추가 (M3 설계 당시에는 프로바이더가 하나였다)."
        },
        "voice": {
          "type": "string",
          "description": "선택된 TTS 보이스 id (예: ko-KR-SunHiNeural)"
        },
        "audio_path": {
          "type": [
            "string",
            "null"
          ],
          "description": "생성된 오디오 파일 경로. 스트리밍/미생성이면 null"
        },
        "spoken_at": {
          "type": "string",
          "format": "date-time"
        },
        "caption_text": {"type": "string"},
        "caption_aliases": {"type": "object", "additionalProperties": {"type": "string"}},
        "viewer_greeting": {
          "description": "실제 재생 완료 후 인사 기록을 갱신하는 수신자 정보",
          "type": "object",
          "properties": {
            "live": {"type": "string", "pattern": "^[1-9][0-9]{0,4}$"},
            "recipients": {
              "type": "array",
              "items": {
                "type": "object",
                "properties": {"id": {"type": "string"}, "name": {"type": "string"}},
                "required": ["id", "name"], "additionalProperties": false
              }
            }
          },
          "required": ["live", "recipients"], "additionalProperties": false
        },
        "persona": {
          "type": "object",
          "properties": {
            "id": {"type": "string"}, "name": {"type": "string"}, "live": {"type": "string"},
            "speech": {"type": "string", "enum": ["polite", "casual"]},
            "definition_sha256": {"type": "string"}
          },
          "required": ["id", "name", "live", "speech", "definition_sha256"], "additionalProperties": false
        },
        "rate": {"type": "string", "pattern": "^[+-][0-9]{1,2}%$"},
        "pitch": {"type": "string", "pattern": "^[+-][0-9]{1,2}Hz$"}
      },
      "required": ["text", "provider", "voice"],
      "additionalProperties": false
    },
    "mode": {
      "type": "string",
      "enum": ["LIVE", "REVIEW", "MUTE"],
      "description": "이 발화가 렌더된 시점의 운영 모드 (M8). LIVE=즉시 발화 / REVIEW=화면 표시 후 승인 대기 / MUTE=화면만. 사후 분석에서 '왜 이건 소리가 안 났나'에 답하려면 그때의 모드가 남아 있어야 한다."
    },
    "spoken_withheld": {
      "type": "boolean",
      "description": "발화가 보류됐는가 (REVIEW 승인 대기 또는 MUTE). true 면 spoken 은 계획일 뿐 실제로 나가지 않았다."
    },
    "source_verdict_pass": {
      "type": "boolean",
      "description": "이 출력을 만든 verdict.pass 값 — pass=false여도 kept_sentences 기반 부분 발화일 수 있음을 추적"
    }
  },
  "required": [
    "overlay",
    "spoken",
    "source_verdict_pass"
  ],
  "additionalProperties": false
}
